"rails, can't display postgres array count results in view"
Question,WUP,RES,JCN,LIN,LCH,PATH,LESK,HSO
413 Request Entity Too Large In Joomla 3.3,0.7108102983803865,0.3149427755169443,0.0012124332422229556,0.39096754711361276,0.5254487000361399,0.3067457521279534
Is there a Linux C IDE that supports intellisense for C library function?,0.8250788040196794,0.4183305182557509,0.0014805938045644176,0.5573334760282168,0.5897785396744599,0.3860274716763838
How to delete ProgIDs from other user accounts when uninstalling from Windows?,0.6283537059326314,0.2541071955292102,7.89754200320882E-4,0.10104543529759143,0.4127065614053665,0.23989844948226982
How do prevent blanks from being created while using nested forms and rails 4?,0.7276473577012085,0.3815655400168261,0.12701523990205613,0.4773984688218859,0.5307965291187077,0.3904897385713719
C# WinForms - How Do i Retrieve Data From A Textbox On One Form Via Another Form?,0.6854736917493249,0.36634593082159805,0.0015275669955429967,0.4442066935297262,0.5022789939368134,0.3376215903223071
Python : raw_input and print in a thread,0.800383882353669,0.5030915620547964,0.0017528233285763449,0.5736266844600406,0.5747858024339763,0.3875948840857247
Can we implement Row Lost Focus event for GridView,0.894212747876486,0.5711571120172413,1.55319313542913E-5,0.7838281978548755,0.712365849560016,0.6203554119547658
Segmentation fault when creating two link lists,0.8505175373613592,0.4577303228251844,0.0020213624919023948,0.5926192752572407,0.5966108969518927,0.4094286726629573
DataGridView filtering,0.0,0.0,0.0,0.0,0.0,0.0
HTML Agility Pack Conversion to XML <script> corruption,0.7912748788123466,0.4243414725407017,0.0013516790004075331,0.490608680345258,0.5516801511692764,0.33674807221665864
How to create a path to a temporary file on Windows XP/Vista,0.7926735670169046,0.37261453070125555,0.0014795599336341581,0.4954226726785871,0.5043469744668704,0.2518770315526379
"Handling ""Big"" Integers in C#",0.6172432060941098,0.19894271504513378,0.0013705434235397216,0.2959153594393284,0.4389686027419682,0.2767929746912927
"App working on the Dev server, not working when deployed on GAE",0.763200332008365,0.4382571053928031,0.001852705733941976,0.5816961852797929,0.5197860973811882,0.3409255141805399
How to get linked resource from a web page?,0.901191403749024,0.5563033938365401,0.0020791685783142196,0.6554384475147568,0.6682020672360233,0.45188207951296655
Java beginner: pattern to track object properties changes in dialog box (save prompt on dialog close),0.8054943804150031,0.44049141055045893,0.0017724394157663317,0.5892516293784129,0.6073870665398141,0.4641532009898823
Howto call an unmanaged C++ function with a std::vector as parameter from C#?,0.7244032461683276,0.3739247688727352,0.0015371519228626397,0.5192910628547274,0.48738319476914976,0.3415995283645369
How could I declare list of generics with different and unknown types and How could I initialize a generic with a type only known at runtime?,0.7938333673274166,0.3713815361838323,0.0018238218431909923,0.5610778083479376,0.5443147196280577,0.323540400382048
screen resolution issue for master page,0.8989481121058113,0.6446719299826842,1.5852210188941627E-5,0.7940684668916298,0.7362381480534527,0.6714514461113849
What is the disadvantage of DWR?,0.6755454465702455,0.20992688042440233,0.001204282488642592,0.24539008271411608,0.5114186963369204,0.25005066965718126
How to dynamically display a status update?,0.8239099194655026,0.5293765235389,0.19050963744006727,0.5984842578414258,0.6616234091774297,0.49305065536230247
Get input checkbox toggle state with Jquery,0.8030463745922315,0.45017276017126145,0.0019465619450192654,0.5750335404484556,0.6063025449349358,0.42552733719092417
Google Maps Marker Data,0.8248054720146423,0.48160543820786633,0.001382149639791207,0.4507768619594479,0.5885305696864103,0.3163841246203348
Column is of type timestamp without time zone but expression is of type character,0.891497398398879,0.6074671114576866,0.00436703101379406,0.779710164484378,0.6789632414748004,0.4830032549760938
Running regini from python,0.8232991150119414,0.5382915277167539,0.0017739417525856676,0.5924737677023819,0.6092836733669232,0.4190571564359352
How to uninstall ruby installed using ruby-build,0.8332174577584269,0.4203289421121971,0.0018449012324091851,0.6083836173476026,0.5774420295665066,0.3871924650448288
Is this a control? (C# Winforms),0.6305104859905393,0.2962157909858914,0.0010950925452999636,0.4176603102938039,0.4063307923409154,0.2766752793557122
Setting the background of a JComboBox?,0.844585847408934,0.5827754194067392,0.003196036657453423,0.6150355674404839,0.6208788387417487,0.4095300013238723
How to execute a script from within another script?,0.8239126637585307,0.39041985503781074,0.0022318066256802383,0.5850452449952389,0.6991780309237781,0.4919532591248596
get page name from button through jquery on external js file,0.7738312336409067,0.4091409900483787,0.0015652899040228586,0.5288737166952732,0.5399552149625299,0.34390416884904884
Smalltalk-style Messages vs. C-style Functions,0.7801746716002452,0.41113409927893946,0.0016029218450489746,0.5330586822782631,0.5570313056637743,0.37622464373072845
jquery sortable can not work?,0.7523692604928687,0.3728123638490994,0.0018844001020824528,0.586671157976967,0.5024537385236737,0.3400493899388056
How to refresh order review at checkout via ajax?,0.8791551577317622,0.5519494832612145,0.002845611087141804,0.7281744445665019,0.6857306065763493,0.44908939173801804
JNLP to install an extension JAR,0.8676780119198143,0.5188182465392444,0.0016559102545660037,0.6095601079673387,0.5998345475732226,0.4189597107671199
How to swap String characters in Java?,0.8142137673225385,0.46746792253261166,0.002113340205229341,0.538880344044826,0.584207633426149,0.3875170104683289
Tomcat 6 XFire MTOM web service problem,0.8280965308819298,0.4516726344998379,0.001593350780211629,0.5799660588951983,0.5556472765767558,0.3021546669228423
Struts2 - How to do dynamic URL redirects?,0.6350618528998576,0.28014736367690324,6.971998978307753E-4,0.10663776421590941,0.4553994657237211,0.25032941458376584
How to start PowerShell from Windows Explorer?,0.8178048767195756,0.34799342056622756,0.0014035547383532924,0.42080866553022234,0.60340734249809,0.38785649871597844
Optimize this python log-parsing code,0.7644548138848447,0.356482631196547,0.0011008766357104298,0.35976822787187585,0.553513086730433,0.3222486743590414
How do you concatenate Lists in C#?,0.786985551082455,0.45362210620629495,0.0015924633263905265,0.4710808154249519,0.581833762358873,0.3720594877662901
UI / deployment to server problem with the toChecklist plug-in for jQuery - step look,0.7720196445203985,0.43009137072866105,0.0014202351759726672,0.49356573465814624,0.5223867610354321,0.318661399544964
What is the best way to determine if a System.DateTime is midnight?,0.7125670020262913,0.33202115571681784,0.0032574042208938394,0.561135911249925,0.5910529915777553,0.44788728916500775
Generate DropDownList from code behind,0.5552669179723491,0.12810548120610196,0.001272320755288307,0.22167978889030104,0.4777363358838466,0.2944426778077203
Warning while installing the rails plugin,0.7604319865151746,0.4673687358898011,0.19022067124935957,0.5016521116828168,0.6303539480874989,0.5037825390762126
C++ Boost ptr_map serialization error,0.7547991928492914,0.383750968595136,0.001192322913188501,0.4684349873479124,0.5220749821911401,0.30433370235012663
Delete all but the most recent X files in bash,0.8591782583152108,0.4906574770390417,0.0019938497550986583,0.6435262486366397,0.6314865803284622,0.3730680063703877
Outlook Addin only loading on first instance of Outlook,0.8672636290364099,0.4643868436481793,0.0022974617365973007,0.6049355678671094,0.6171621575472268,0.35606816237228456
problem with using SAX XML Parser,0.805378276516421,0.4095130913653006,0.0012801872214710031,0.44678758042286726,0.5542339649089295,0.267472775194405
How is public key used to decrypt in .NET assemblies?,0.7948855348103984,0.454725323192736,0.0013169583284665066,0.4828516495045262,0.5580599599028975,0.36302404197427984
Stored Procedure Parameters - sometimes NULL,0.8706128406965967,0.42385284317833777,0.0017014130079210461,0.5993538188344367,0.5860797256958211,0.31215825725866575
Missing parameter in Ajax post to Asmx,0.8265379297226138,0.4157842514476271,0.0014256807393143354,0.5666809143537809,0.6034010045482263,0.393477265460697
