Gruntjs concat & minify | Option to replace the code in destination file instead of appending
Question,WUP,RES,JCN,LIN,LCH,PATH,LESK,HSO
Hibernate: updating an object in a different Session?,0.5984368589401563,0.22117765817665697,0.0011037182845958413,0.2710705263977301,0.4442740317807448,0.2514350055074707
Python format UnicodeDecodeError,0.5358979677789929,0.17065762674844479,8.609976161594922E-4,0.1264045873634575,0.4264857171152924,0.23363229610714842
Android Screenshot Plugin Working in Cordova 2.0,0.5208527360834324,0.27918705003584504,0.0010054272574965414,0.3054750816223942,0.3773035770742719,0.22161800568579548
Which other programming language has similarity to Java?,0.6242466363006487,0.337185186821089,0.0013640532074773103,0.3855897520658778,0.46970224045451825,0.27009228150961034
Ember.js: Save a record in the local store from DS.RESTAdapter,0.6035805147944625,0.28127471326346615,0.003191014948727852,0.4696270010520881,0.43951249039592044,0.30313840070891535
How do I verify jQuery AJAX events with Jasmine?,0.44274656930776796,0.1529164503295867,8.441722235840704E-4,0.1583233164937,0.35441765539334597,0.1914477469759585
How to keep 2 tabspace formatting in File Java,0.536918306067667,0.2492300144964873,0.13553929967594425,0.21687068547499688,0.4528291370820551,0.2876367640542562
How to calculate the effective z-index of an HTML element,0.5468547453775201,0.1704231506766618,0.0011844188975041986,0.2904900980154306,0.4294367469740587,0.24134159368599314
Android OpenCV retrieve intersection point,0.6633901766367472,0.4063476883228272,0.0011788400837552775,0.3127938398374642,0.46527391744628765,0.29792340206721213
Installing Android SDK Manager in Eclipse,0.6095015139798523,0.2034877993073148,0.0010580549850732668,0.2611374848617394,0.42912325759756836,0.25454480610053243
How to track the memory usage in C++,0.6867992511713756,0.31129793937090705,0.0013311638770609352,0.3350028673374551,0.455077534153527,0.24843222070677232
Execute an external .exe from a local .swf using a local XML Socket server (C#),0.5555413817948144,0.2651769067399656,9.279959407807498E-4,0.27607459034283705,0.3648140370707634,0.18991342917888382
How to know that my callstack is wrong?,0.487218230635316,0.09521698597500396,0.001037836714418791,0.15483068387016005,0.3867279365791341,0.1936248005003189
Seekbar on android not moving automatically,0.6425508839488937,0.2960554950098983,0.004312778586849896,0.37621752046807067,0.46220945864544444,0.29635941523395665
"Created a new database on SQL Server, can't be seen by web apps because permissions aren't set",0.5884974674937546,0.32374528583326245,0.0013815409329722764,0.3707048230274496,0.40130246075707426,0.26242424780343526
How to reference $(this) when using on(),0.5528240234434475,0.2876586135570226,0.06501813643403785,0.42609896204668773,0.42352232810005797,0.2846295847290047
Javascript: decoding a string,0.5937169539003959,0.3357400083588792,0.0011615430072655017,0.2834238795471432,0.41875474389491973,0.2726685754907021
Get server Port in web application at server start,0.7526801656128775,0.43413374578701835,0.001889423398663533,0.49771214106886796,0.5539964227792926,0.3728236724102764
"Why does my C# ""hello world"" COM client and server throw a cast exception?",0.6008765096489704,0.23878701294975696,0.0010008974172837136,0.2928006130749253,0.3960907697882592,0.231669027207489
How do you move a CALayer instantly (w/o animation),0.4230537994890276,0.17789890490500937,0.003260177483995806,0.30197817734004595,0.30719201968609816,0.20565176885627665
How Do I Clone A JAXB Object,0.5729022806877568,0.2597033123792814,0.0011354905003647523,0.23641084317375077,0.4115031640782584,0.2220476577539783
Any easy ways to play an audio file on a remote PC,0.6426128272582297,0.3588539465239683,0.11507190779912216,0.4011250474368633,0.48257194595523867,0.3327416982888262
sencha cmd5 phonegap does't create .apk file,0.35676461870744813,0.1884917535929912,0.13533393246747974,0.19304291255587025,0.3227676976298271,0.22819512856086455
Camera intent for temporary storage,0.5705143002870922,0.22074106348842704,8.051094802683632E-4,0.31888841219883945,0.3246175478789491,0.13677465864201233
Cannot find symbol error:,0.6268425649397915,0.2684111597526964,0.0014644937293139012,0.4332340982259596,0.4823263190617954,0.2886862048705243
"Jquery select option, using data attribute in Simplecart-js",0.5475199107711309,0.2373749169139554,0.10750313012640837,0.24083714148472016,0.45114195901388493,0.286167293466275
Node.getTextContent() is undefined in Node,0.2629140231463215,0.07533235925709747,2.878279548615299E-4,0.014956495389987771,0.1594107087515045,0.06189751275308792
How to save the text file without dialogue box in actiondcript 3?,0.6752464511225977,0.3642301332680773,0.1157310004896671,0.4624819449356859,0.5118142069953573,0.3437989235904018
half on the right and half on the left,0.4811645865686314,0.20122927999599635,7.712827070079271E-4,0.2557354050767825,0.302903150540494,0.12346148573015966
Why does the JVM still not support tail-call optimization?,0.6655199675608312,0.4322125209427037,0.0011391017487743051,0.3605879152938502,0.4684250081652257,0.3260154986870862
Transparency in GD PHP library,0.4784825294597964,0.13711550498498482,4.734213241671308E-4,0.1425247323661092,0.27771986144480554,0.11428283913261389
AFNetworking JSON Response caching: offline mode,0.3203466132923865,0.20730327914877753,5.291430541373326E-4,0.1950759759706336,0.19294930003583155,0.0882583990250994
Empty UL inside LI element,0.5909565238925573,0.20957154644177894,0.0011172336272541096,0.34188248059993304,0.43069553659604765,0.2555354353240106
labeling relationship lines in mysql workbench erd,0.31696768736478564,0.10952788725016535,5.31256848395509E-4,0.16502958315149624,0.20139333397230164,0.08953773628705572
Can't set innerHTML of td on IE Mobile 6,0.6024871469076037,0.282426667757611,0.0014198269264081294,0.34125859568662575,0.43896321173362507,0.28982968922143915
mootools replace the content of a div,0.5758748576837295,0.35157898697801127,0.1522522721689113,0.5030736142681073,0.468461423128251,0.35138969039907847
The simplest way to draw points on iPhone?,0.4910931856843899,0.2690836007959597,0.001242645925173997,0.36899584324429885,0.37168898511930254,0.2535333828145181
Standard Library Reference for Ruby,0.6622371354780103,0.347127226318379,0.06522246477094623,0.4890494081077042,0.5025607591370806,0.3196484623088368
"How to rotate, scale, and translate a matrix all at once in C#?",0.6354336627880592,0.3621618618631214,0.0011657599173539664,0.3450656377928054,0.46141466843602413,0.2859347964163521
Access to private method using reflection in C#/Silverlight applications,0.6084654209355089,0.31576980114112624,0.001090304982678714,0.32911376603598247,0.4395308709662853,0.2819269639808396
Quick way to find all columns after current operated,0.6875035461192747,0.3664036912874761,0.05651235959967908,0.5144219353148317,0.5485912160886416,0.37808236208303053
error: could not load android-info.txt,0.5961720788359287,0.2519644220260807,0.0010013330492565026,0.3199730241505106,0.4112385251215988,0.24484291021671323
Java usb comm with Nexys board,0.46478802118177664,0.18750947326518663,7.908494411136928E-4,0.1739000219132075,0.3515339015712602,0.18012743839519446
Getting an error inflating relative layout,0.696480390635634,0.3045082103930058,0.0013650814186297305,0.4132446109492054,0.5005375265060321,0.3117553800889693
implementing an unordered map within an unordered map,0.5479965016627928,0.2934501679540038,0.0016024578534809418,0.456459482911988,0.39691302513762955,0.22260414151845426
Relative path reference in WebConfig.ConnectionString,0.6227387089139376,0.3135887809875051,0.06532521299009214,0.48159555828570255,0.4717341769461505,0.3132116447731529
c++ program stops without errors warnings when printing matrix,0.6642373379886868,0.3810382079885747,0.0016312362457516403,0.5089045564258502,0.4796860370394118,0.29381460155634026
How can I get my basic SWT application to exit properly in Mac OS X 10.5.6?,0.6760566650972805,0.34105342288318996,0.0014083465082197289,0.37195830864244844,0.47446642441996856,0.2994915576871153
ASP.NET MVC View friendly name for foreign key,0.5472549603280544,0.29777013577010747,0.0011080552357675324,0.30122009134266065,0.3815603832980674,0.21759023910490943
Get Raw HTML of Node in JQuery,0.5982302803381099,0.22903743111918506,0.0013448413508387806,0.30686397111599995,0.43387215686090597,0.2638057155870888
