"n-layared architecture, is it only a 3 layer thing?"
Question,WUP,RES,JCN,LIN,LCH,PATH,LESK,HSO
"My DAO's are starting to look the same, suggest a remedy design pattern?",0.7871588603596786,0.41099692389155107,0.0017705337131552106,0.535158753715092,0.5506348430473168,0.30274975650097624
Show only Browser version,0.8622229046612441,0.39948303077464975,0.0015272817829294406,0.49375967799822396,0.5968156143121539,0.2891088909100949
Apache Http Client Encoding UTF-8 not working,0.8529551347333216,0.5120409672494686,0.0024156099491393942,0.5608276542576625,0.6178656299539134,0.40092522089058524
How to invoke C++/Qt function from Javascript in QWebengine?,0.6670457408759446,0.3028473867265354,0.0011486111516203126,0.4362523953440404,0.41403725928061924,0.20658933337986765
Google maps JSON markers load asynchronously?,0.6284792448134778,0.2087482706357557,7.598913211983938E-4,0.25155134587997724,0.4616295296323199,0.2623119762886809
UIDataDetectorTypeAll and popup in app (or at least ask before switching),0.5700383297893935,0.17350640731244926,7.611687573773252E-4,0.25170657814909436,0.34701871923682154,0.1711817836591429
Xcode iphone provide rectangle margin while accessing camera,0.7294821287032219,0.32502993614074066,0.001714505257081732,0.440832667433352,0.5036243262219099,0.25312408620797533
Downscaled versions of jQuery or Prototype - JS framework selection,0.7856962611899418,0.5001080023109894,0.0013301052384095116,0.41620043661708694,0.5606429932286887,0.36017505943577205
How To Read A Remote Text File,0.8522495309562302,0.32445220600346647,0.0013146363320479407,0.35626696008360154,0.5862792250460316,0.2830721521170152
Notification not show in Jconsole JMX,0.6873038222849744,0.2588313903306856,0.0011952826103661506,0.3648030746376009,0.46232771604136047,0.21863358017414034
Query the database through a query string,0.7877359669326793,0.3276808198982405,0.0014786832805876423,0.4340760706957587,0.5516473296251438,0.27690021695741546
Remapped Commands only work in some windows,0.7001476755865585,0.3912860152522285,0.0024144777198477174,0.4937384637256538,0.49400914552346054,0.33176560283429773
Plugin to enhance HTML5 input[type=range] like jquery-mobile slider,0.6304381906985375,0.3268895140948989,0.001013302018992218,0.2943999882963672,0.4337493565765733,0.24959827363658824
How to use ZipFile Class in Java to recursively open all files including those under Folders,0.7226719894154783,0.3402723167389505,0.0014740831569511439,0.49454587493063507,0.5064196418353596,0.2851975478655277
Applying two xsl templates alternately,0.11469246887266565,0.0,2.7200129569764683E-4,0.0,0.12333876266599451,0.06764993412062358
programmatically fire onchange event on polymer input,0.8097167049611674,0.39948942722637787,0.0019019777677912728,0.575880252637685,0.5707021634182127,0.3423241018801681
"Multiple Uploadify Buttons, which had a file added?",0.7764167493737918,0.3174924630559102,9.644031543282048E-4,0.26786404492233656,0.5275682305259796,0.2964216018869442
SlideUp() and SlideDown() effects in IE8,0.44499440397054446,0.10352410054598589,0.0,0.0,0.27789055967707044,0.10678028521048101
Image under toggle navigation gets pushed down,0.8279778428731254,0.384673328857073,0.0012915284518313609,0.4527643781329335,0.5698341657573074,0.28790985200478636
What is the best solution for migrating Linq DBML tables?,0.7008928339919597,0.28322948835435724,0.0013811580189391078,0.44172723283969634,0.4687713236297841,0.2570530253577882
"control with ID 'ctl00_MainContentPlaceHolder_divDetailsContent' could not be found, but it's right there!",0.7895799721438821,0.29342207133179465,0.0012425519923086783,0.42621952140286795,0.5457964579710379,0.3043471186120423
Trying to insert an entire Table using innerHTML in javascript,0.7741101888622324,0.32956246293577657,0.0010423034970533528,0.2784982774478724,0.5236951790983375,0.29431426824116763
"In Java: List, ArrayList and Map, HashMap",0.7171225272578948,0.3214381289547278,0.0012992621891776434,0.4663761835748749,0.49671141238124056,0.2695276925903406
Keep text in place after header moves back to top the page,0.8922161936012228,0.5013502859609726,0.0024636841963064497,0.7009361183935436,0.6636376613571915,0.4344073405254543
Obtain the password of ASPNET account,0.737918881791937,0.27852860417349207,0.0014078339814714341,0.3230826067755923,0.5474188512305213,0.30801109485310696
jQuery Multidatepicker Calendar opens and closes between date selection,0.8035446163379394,0.360157590522578,0.0014868828970602248,0.5110632371859187,0.5443251062199767,0.3090241433480364
Calendar control to show databound date,0.8690417155606408,0.3745403230129088,0.001613381057058977,0.5751271096354001,0.5769266580924785,0.29433692469227063
Move rows to bottom in a TableView which uses CoreData,0.6153107302877593,0.2389787639868969,0.0014051415996432861,0.4012273878254292,0.4081548333167482,0.23085178221803693
Dropdown Menu That Creates An Input Field,0.7982199948935862,0.4296140116983528,0.002333548442006005,0.5798051184328088,0.5812928688044507,0.39582927868198053
Not Throwing Errors in a JavaScript Library,0.8336110587012681,0.490365838237102,0.0013169711257283857,0.49078787510339345,0.6247360890285296,0.42663446026261514
C#: byte array in xml CData,0.708729506413786,0.2717530261844641,7.316185504900461E-4,0.14344490429871265,0.42435962404152594,0.21100288220470576
Why java classes do not inherit annotations from implemented interfaces?,0.8194217592943666,0.33787354005098535,0.0016522226986378373,0.5211804730263135,0.6022523600538328,0.34186683091223297
"jQuery Sortable and Bootstrap 3 - works on small device, doesn't work on large device",0.820036696302047,0.5279740391666029,0.14634141554679891,0.5880742078402572,0.6376795817761844,0.4742232364558406
"Jeditable and issue with ""select"" fields - access & update JSON data dynamically from client side",0.6917285265538412,0.3148817555142427,0.0018558509559345085,0.4463096532612672,0.490917773137732,0.303091707803445
How do I filter valid styles in a TinyMCE 4.x editor?,0.7158511406587182,0.35965922141337386,0.001732086391624639,0.460464475398274,0.48477040741419947,0.2840926495695459
Can debugger be called in a Javascript Promises?,0.8351718442209316,0.48821834883722104,0.0016409367647466535,0.5168285739462185,0.5692181642407115,0.2982094740707522
Configuring root directory internal ASP.NET server,0.7702488296646949,0.3953438154309374,0.0012822889884432094,0.4219120792689372,0.537827013192566,0.29813968676905594
Can you pass a delegate in as a server control parameter?,0.9141159528279734,0.4913981747900737,0.002045736753766979,0.6515949567206767,0.6402536730486164,0.35114200403595996
javax.persistence.SequenceGenerator and Allocation Size,0.7849043203649423,0.375843882612276,0.0015567341448557313,0.4787054087622161,0.5733984976255614,0.3234818047971583
Disable/enable entire form's submit with jquery,0.7046467726541582,0.34783562206326724,0.002184163883951284,0.46691028354681724,0.4705236549994642,0.31645159443653476
recursion issue with preventDefault on form submit with jquery,0.6980850189063635,0.23386227184629504,9.932604028365555E-4,0.3004884233454236,0.46002267596677404,0.239920920294146
Diferences in this two approaches to sleep the excecution in java,0.71373649490229,0.3216243850065791,0.0013548656630700377,0.4713881401792946,0.5140109974533269,0.29148085588320777
Best way to parse HTML in Qt?,0.6969585065220634,0.3039152063906282,9.81146026558571E-4,0.2568033796859967,0.44269162830862685,0.17786524215033517
getting error CallableStatementCallback; bad SQL grammar while calling procedure from postgreSQL,0.737610167090641,0.3700810140983937,0.0010927080475051185,0.3681445284668659,0.49999449077909897,0.2751683646945497
How to combine variables with Jquery?,0.6573480911511207,0.22466646104325924,9.86640263126457E-4,0.3291699107869859,0.44290181304407694,0.21826005053725595
Jquery Ajax Callback not working in proper order,0.7490198960361124,0.3721211019830317,0.0021564925665187233,0.48730843911439603,0.5802861237340193,0.39169299706441246
How to update style after ajax call in jQuery?,0.8020626288491711,0.39044335689487925,0.0012257308834393616,0.3752696713088998,0.6045636951473534,0.33841918355632716
How do i split an Integer array?,0.9278658619120302,0.5201453833924595,0.0029137250248011132,0.6567315410351108,0.712270730473687,0.45374879342352814
JAVA cache growing on citrix,0.7414878813764392,0.29081212392044326,0.0012894083913502603,0.3940459063300634,0.5645058460302095,0.31019592225221887
Spring MVC Setup not working - Path issue?,0.8616442261171143,0.4819484475492044,0.0027169229954398764,0.682658982805065,0.6244630188225062,0.4110097843184173
