"Google Spreadsheet, IF value is greater than 2 take the value next to it, over a range. Then sum"
Question,WUP,RES,JCN,LIN,LCH,PATH,LESK,HSO
How do I run some VBA code when a cell is changed?,0.7833348784142705,0.43945596914487584,0.0019175863955293846,0.5106394898679794,0.609913575053492,0.41383241282865646
Haskell sum of generated list,0.6031575632276298,0.400909613860586,0.16825120636623433,0.48504153911771103,0.4914595811437039,0.3620972204874421
spreadsheet: use equation to calculate value,0.7691944407661108,0.42012389730582056,0.145520715979053,0.6975701387064478,0.6438272865784836,0.5793973460175063
Attempting to sort long list into separate columns,0.7820930662175685,0.4065663621853567,0.002279339834144281,0.560976998372971,0.58691331336222,0.4137952564647039
"How do I calculate a date by adding 30 calendar days, where end date must be business day?",0.8392283262155842,0.48254191970593696,0.008129280810092829,0.6570842174641365,0.6389680525068749,0.5127364107078936
R: calculating column sums & row sums as an aggregation from a dataframe,0.6983125841246933,0.4263556909482024,0.11256154600388023,0.5001224588869452,0.5288479283538924,0.3788991157840726
Using 2 worksheets to calculate in sql,0.6771703337505337,0.37080497559558945,0.15010028984235263,0.4660455685368743,0.5233952031734013,0.38325300700910503
"Split DateTime string, ArrayFormula, Google Spreadsheet",0.7306437880462678,0.39320267818345583,0.13688029385000558,0.6035644823982513,0.6089667259979932,0.5716262460198599
How to select the the highest sum of value in mysql,0.6465455379089394,0.44286939685363286,0.0033955391499560558,0.555947487790515,0.5847727812012322,0.565439730079317
How to elegantly sum up nullable and retain null when all null,0.6212338311950146,0.38291493552472483,0.15064273832246344,0.5174375774869971,0.4992844472584527,0.3423821113271491
PHPExcel - Using example read fiter,0.5841882049436802,0.2662345024136198,0.004414933776756253,0.3926176929723917,0.44923506208909497,0.3989383187932604
Use spreadsheet function in Google Script?,0.8337101547800382,0.6017732871076229,0.1593446789588587,0.7437282831972996,0.686175090166447,0.6223968442990397
Google Spreadsheets (app-script) copying a row of information to another spreadsheet,0.6526450948138425,0.345785666274607,0.10628116069927988,0.47785750138765015,0.5097540183306924,0.4210185870472792
How to find the sum of a word,0.7972561669407069,0.5630206340961057,0.19492700063223517,0.6193985184325153,0.6769230997438009,0.5528851712147727
Google Sheets: Can i get a non-contiguous selection as an array of ranges,0.7651005461016248,0.5408389269604732,4.264397525166801E-4,0.5886028801297226,0.6078021338651048,0.5371195675155631
How to use protection setWarningOnly(warningOnly) in google spreadsheet,0.6051407222766646,0.23902814225257332,0.008222936309312293,0.5474364414152951,0.4755615305539331,0.4247278962430151
SQL Multiplication query,0.5604342708556481,0.1825003523383283,0.0010134507236992266,0.26711309239289144,0.4166930272136099,0.18810560000864157
SQL SUM of a ntext field using LEN,0.5927761897871652,0.35519298943995287,0.1373905795456939,0.4307555176774701,0.4702428451392469,0.3556404440119
Add a Worksheet using Zend to a Google Spreadsheet in PHP,0.7487463910894019,0.4305367826842961,0.008145766550637644,0.6299422029635126,0.6189795185022178,0.5856034361193156
How can I assign a Swift struct by reference?,0.7562882109754296,0.427914796654391,0.002334118500493719,0.5205626175851368,0.5898075712899717,0.44182356122423755
Formula with custom script doesn't update in Google Spreadsheet,0.8237493947788963,0.46495602716889306,0.13701072020305555,0.5998129413275033,0.6527538687940745,0.5372514691841546
PHP Excel multiple export in multiple sheets || Fatal error: Uncaught exception 'PHPExcel_Exception',0.5648323123688485,0.2429539382022048,8.166107453006679E-4,0.24596178367870353,0.40533394798395755,0.23610603090518956
How can I find the Size of some specified files?,0.814241742467384,0.4658244269565728,0.003416058684309445,0.6568705188908268,0.6242868833174674,0.46588026505840735
R Sum complete cases of two columns,0.7165848459948129,0.4402599002577613,0.15060374721354522,0.48817989646940624,0.5680584431501313,0.39834752610910906
Im getting the error = Cannot assign value of type 'String?' to type '[String]' Ive looked everywhere and i can't seem to find the answer,0.6567206688112858,0.4015683120994019,0.09814750184493187,0.5500091887760115,0.5097336306702607,0.40205920404955164
What am I doing wrong with gspreadsheets' vlookup formula?,0.6713415180987876,0.31590150696031866,0.001866223865275546,0.46968892853126193,0.48059488228293273,0.27992142683313204
"xpath on Google spreadsheet ""Internal import error""",0.6889300045607398,0.3408935132616108,0.1190273243775787,0.5815340028408815,0.5499470514390828,0.4659676705644917
"Google Sheets, script editor arranging separate columns",0.7740667206121753,0.48349261553036127,0.12752957391313596,0.5245084019674976,0.5806333602370672,0.41389564551151586
"""integer out of range"" error in a for next statement",0.8154735321171362,0.5571245141050893,0.23752947672659047,0.5838512204862529,0.6724377383093432,0.5149586606648431
".gs/.html - Google Apps Script as a Web App using Form Elements, Html Service and a spreadsheet",0.7710566221570385,0.49068808062958114,0.09399836273833583,0.6278973017474908,0.5935013083420344,0.46600386458309956
Spreadsheet formula taking too long to run - script advise,0.7959773232014289,0.40416231181300455,0.0013696596446599655,0.5740549041786748,0.6271546228359011,0.49938367252392235
Insert Script on Google SpreadSheet programmatically,0.759667589072491,0.44054043953458266,0.1499997269460418,0.5680942509982396,0.6157636260720598,0.5304966625890777
Why does Google Docs Conditional Formatting with custom formula not work?,0.7002600702645285,0.4049410802810129,0.12805756358041878,0.4744862055012597,0.5307771346603406,0.3890587385956145
summing column up on row condition in SQL,0.6998799810284424,0.444385697466005,0.1507113748417269,0.5111078048322103,0.5465371560433335,0.3481249508929399
Segmentation fault in bitwise component sum,0.7079579704512488,0.412181481898768,0.15094098348425505,0.5328429936031286,0.567979068425653,0.39434844549591297
GAS format date display on submit,0.8122724770968529,0.47011272370649326,4.2634895571982853E-4,0.5768745960488593,0.6206198611524342,0.515235378329036
SUM and GROUP BY and Difference of colums,0.663877923239482,0.40239819857727005,0.15070491711509829,0.4863305763463654,0.5342112736881103,0.36705734775102594
Only add cells in column when the total of multiple other cells in that row equals 5,0.7553353391947913,0.4937961291845122,1.554673864161282E-5,0.5745248672189318,0.5931428480281244,0.5014598076588375
Implementation of spreadsheet in Python?,0.7852499744216374,0.2213303482249916,9.152751809153346E-4,0.47548733580262864,0.646826115988803,0.5167620697302265
Strange SUM() result,0.5501867016307631,0.35591141887059347,0.15030051035308079,0.3923245795071905,0.4380133739860627,0.3046110377931427
Google Sheets Time-driven Trigger. Need Better Time Accuracy,0.7906079699847156,0.44063527700606375,0.005486754853042171,0.6529688334309884,0.6343982059580482,0.5649060216384639
Summing specific data from column in r,0.7366219203579417,0.4718140315556236,0.1506100377311144,0.517280334000936,0.5637612519273447,0.36488237149479436
MySQL SUM on a query with mutiple values,0.575316709817936,0.34543552829037616,0.1680813468016443,0.4433592621732326,0.4653273674464453,0.3140365642005098
How to write merge cell and unmerge cell together on one single line of the excell sheet,0.7636541087877053,0.3929818500964453,0.002134728585282969,0.5355157925591164,0.5794827987222204,0.38203189527461834
Google Sheets Script Parameter for e.g. Button,0.7125502606854464,0.5342001745137525,0.1373774034345991,0.44574436272481593,0.5473586818250966,0.4108746369243727
How do I import the list of files from a Google Folder into a Google Spreadsheet?,0.8550067673122582,0.6097187252340948,0.25473770550603836,0.7891796172374363,0.6898265409569713,0.549305063129609
Android sql error when using SUM,0.6832900813086717,0.38971160914205616,0.1504567466755633,0.44765571776231544,0.5199170915764024,0.3240514318450414
CONDITIONAL SUM T-SQL,0.5601332882163893,0.36212099674594067,0.1938712915463743,0.4383141763615494,0.47915720489744884,0.33412860037731634
How can I create new spreadsheet worksheets in Ruby using the Spreadsheet gem?,0.7805989338071595,0.3446733675686639,0.001624642768968802,0.5892696756997746,0.5926784194015399,0.4419457925994977
BigQuery Access for New Google Spreadsheets,0.5913912022060747,0.42734899252644065,0.14977081888333846,0.3770494943675575,0.4474794633960737,0.31296936240268963
