"Nullable<> types are a BCL, CLR, or both implementation?"
Question,WUP,RES,JCN,LIN,LCH,PATH,LESK,HSO
Using Javascript in Google Web Optimizer Page Sections,0.3247495182672208,0.07802961703857346,4.7289418298633335E-4,0.12503588691088344,0.2290364922120681,0.114463167726196
Draw a polyline based on user click and/or current user location,0.46080257125239826,0.1408985087314492,8.803071801277174E-4,0.22472607246176698,0.29093042098538935,0.16916843325937483
FileSystemWatcher ArgumentException,0.0,0.0,0.0,0.0,0.0,0.0
How to programmatically align an Android TextView to the right of another TextView,0.32346390426432703,0.12516847917128718,2.8105415049054134E-4,0.11894106934973708,0.1948027727616898,0.09379326316448366
Homework help - Javascript coin jar,0.34221190583223976,0.08591767449566194,5.687872485884256E-4,0.1630282655821041,0.23757615584454952,0.11702592901582119
how to restart a Thread?,0.40958972721666675,0.12072284162790042,6.141862054763688E-4,0.15527323177608537,0.2796252952867849,0.15787724448766816
"Is there any way to pass the password to pam_start() or pam_authenticate() and bypass the ""conversation""?",0.2652191954396354,0.060828442197682464,3.70907628214751E-4,0.09980642383047243,0.18853002502678223,0.09852243215134414
How do I check for valid (not dead) links programatically using PHP?,0.3454569426703129,0.08431325831588374,5.975928202965812E-4,0.1503606473557059,0.22344364043359274,0.11880680980098975
Cannot Post to site using Xcode.,0.3961652902657112,0.1283972522897289,6.930588613605659E-4,0.18851377791944282,0.24218371722412277,0.11848509317448452
Using preg_replace to make ordinals appear in all lower case,0.4221921636506906,0.1781281163624178,0.0014826602391340164,0.33158569912826213,0.27832545159305744,0.1781709510130955
debug with multiple processes,0.13100678694146012,0.0,0.0,0.0,0.14464047751069786,0.0758632103556081
Javascript find and replace string within substring not using jquery,0.36161526670770866,0.0948834816107985,6.484679237045145E-4,0.17347364775174437,0.25885939079901493,0.14540053717422716
"Parse, UITableView and reloaddata",0.0,0.0,0.0,0.0,0.0,0.0
How well do Eclipse and Netbeans coexist?,0.19403709474313757,0.0,3.958775307724316E-4,0.0,0.20399534158075164,0.11717470278335147
Passing object as parameter in method,0.4036387109878996,0.04411980966043856,0.001144946656547672,0.13976321749579465,0.29520074925775786,0.1569323306371914
GWT - InternetExplorer UI issue with HorizontalPanel,0.2312722647286604,0.05592960481725331,3.353944986894412E-4,0.10079375035101008,0.13654874708388043,0.08361963274520864
How can i get content of web-page,0.5610528156651189,0.24357630023034862,0.0017857421099836085,0.4163733768069187,0.387270702805144,0.24840548381211583
Precision problem with LINQ to dataset in VB.Net -- Double invalid cast exception,0.38742496254440245,0.109846416381715,7.075757691947205E-4,0.1799620953220026,0.2730071704676564,0.14037372828904304
Best way to reuse a footer menu in Android,0.4960361223442172,0.18101333892091725,5.623695249492662E-4,0.1892123162198519,0.32598464449238934,0.1908392697999691
Angular querystring parameter with a hash in it,0.188967874822568,0.015475417123599063,2.2953175382514266E-4,0.0,0.12981429539990616,0.05964239459897781
Mysql Database Backup from Remote System,0.4842796668996825,0.1424569832813432,7.440740621374214E-4,0.18946652462923486,0.3245468992876113,0.18549996653169248
How to delete part of a CSV string using Ruby?,0.3636761162696587,0.08219880768841661,6.975388142376315E-4,0.16159535057287214,0.2508554955343456,0.14685565149308158
More Jcombo boxes related to one JTable,0.33805137643974276,0.08591767449566194,6.458551500254732E-4,0.17476855381017087,0.2352618686171066,0.13940300707146458
Video length of playlist items Webchimera.js Player,0.3857595558843107,0.0961107975832453,6.393312901860926E-4,0.16759811093700733,0.23923349688491063,0.10034031290689266
How to bind array to Data template - List Box,0.5137390988382404,0.1369547210356347,9.8179728596751E-4,0.1938474471704257,0.3529470168480604,0.18510139622725863
jquery set select option has no effect on the html,0.38349580956987656,0.07656377729014588,7.377405872804783E-4,0.15023872160437837,0.2853987423149651,0.15847618769500438
Open local directory from ASP.NET MVC 3 Intranet application,0.4559607488379274,0.12846207967612366,6.352273856517049E-4,0.15779987073137802,0.29451882575166777,0.1476770999016409
Tilde operator in Regular expressions,0.4642351212155849,0.119932646179688,5.910132953879698E-4,0.08538719792669766,0.29651214629746203,0.14952887051208605
(Java) Good Libraries and What they are,0.29814004029690255,0.06281256971480834,6.194737343376722E-4,0.15168616139647564,0.1976673271137627,0.10211256284323635
How can I get TotalPages in SSRS Report body?,0.471814514554122,0.16230235036086305,0.0014612103037549996,0.29363328728405,0.3211232434081654,0.19711635098648367
More option menu window changing its position,0.42609038797602905,0.09681251888174482,7.66501085707075E-4,0.14857165677283668,0.3143365303407615,0.14686451211960536
StringBuffer Hangman Game Null Exception Error,0.3943952641447435,0.08422913832304589,5.696657979270892E-4,0.05396029527459328,0.27072148014150554,0.11494044507372224
SQl Server 2005 Pivot,0.39801252958902317,0.19490474814960357,3.763449223265828E-4,0.06253307373230615,0.2516576372316747,0.15382390610633204
Playing Embedded Audio Through WebView Android,0.36840464793427236,0.11499175964619689,5.686436454226189E-4,0.1550008429280645,0.22185190101683688,0.09682382410913287
Should HANDLE returned by CreateEvent be disposed?,0.4083911631828921,0.2058935376103042,5.606563768437368E-4,0.14676331909535337,0.2734971893573623,0.14916238115835792
php javascript cookies,0.0,0.0,0.0,0.0,0.0,0.0
Pass Model to Controller to Change in Controller,0.4856309717078482,0.13127553843994455,8.200522335259936E-4,0.2517696923534936,0.3381047607475387,0.18151586845876008
OpenGL: Text is not displaying after drawing rectangle,0.409807630233847,0.12071511358742068,7.075971112991216E-4,0.2128326575649176,0.24979514563907498,0.11317123531141235
Django Cycle formset field values and calculate another field via Javascript,0.3580276561719858,0.09555863757276188,5.6825777819776E-4,0.1713992915484917,0.2357021519473612,0.136770208538528
JQuerymobile and Bartender Tabbar - individual icons,0.19803860984352292,0.030823017717395176,6.175134760260069E-4,0.11063071727253096,0.11544207218052598,0.04812616556968688
java getting Last line(fastest way) from a String Variable,0.4093453540184686,0.11593311748549302,6.924905416534397E-4,0.20231588425605967,0.2603091362984765,0.13191344747598824
PDO invalid data source issue,0.44324390541348924,0.12638328844778832,7.430903965646684E-4,0.2060099281236394,0.2938401233522189,0.1634489350408269
How to find specific cache entries in firefox and turn them into a File or Blob object?,0.5253882221037975,0.20496595870108833,0.0012388535208346606,0.3129168426287208,0.36462160225047147,0.2069512998438839
SQL Between clause with strings columns,0.35733832550123484,0.11499175964619689,6.470458618396913E-4,0.20641923487403294,0.2377583447838073,0.1155941038822608
PHP Attaching an image to an email,0.3351760466619202,0.06248828585608062,5.52448580035197E-4,0.13121877172822566,0.2457415713838856,0.12929603144881918
HTML DOM element name as a string,0.3780213442012903,0.10045394549258525,5.987335867041781E-4,0.18986321058469524,0.23695167087064542,0.114090225760375
Noob Capistrano question on preserving upload directories,0.30954791314858815,0.06302889053140942,4.720061957304963E-4,0.10889998594742614,0.23541691910467297,0.12720414551103285
communicator 2005 automation api?,0.40185226777053856,0.10293518249149755,5.069685240571181E-4,0.08382946292502898,0.2759766360633818,0.13715421330944264
Javascripts Object member access,0.3174481199898338,0.04913917323731647,9.084411721385214E-4,0.1527300043135024,0.201631831045139,0.09368817156946792
parsing <sup> tag inside <html:text>,0.34483341963523906,0.0690130615634464,4.4495164018781976E-4,0.13026707482921607,0.17700038602891713,0.0880392410434364
