Can you replicate data from MS SQL Server 2005 to MySQL 5.1 one-way?,0.6954936907374603,0.39584791366416316,8.393396807467406E-4,0.2718692071993303,0.4956867817468976,0.3107571865706948
How to identify invalid (corrupted) values stored in Oracle DATE columns,0.8036206222853147,0.4663582203043574,0.0012702089367288866,0.436436985172739,0.5535067459292315,0.34113072047098886
Is there a faster way to perform this mysql query?,0.42337650073409794,0.1897004921900424,8.602116100689214E-4,0.3075642359592616,0.31512973652736814,0.18938635139590046
Java user.home is being set to %userprofile% and not being resolved,0.6868816765895197,0.35632061366539064,0.0010950346856197536,0.4300509921461441,0.47549204886915547,0.2717941335958392
Skipping an argument using the javascript .bind() method,0.626193649747093,0.3068980527974473,0.0010910598674879976,0.3839136006707987,0.41453746047260887,0.21936787799071744
One strange issue about $.load(),0.65685642846311,0.3376958395536469,9.148004645930245E-4,0.3422343783169939,0.42153130626322954,0.25013323646267793
Being cautious of the volatile/synchronized performance penalty,0.7188121262676851,0.3701602809903731,9.29000272495635E-4,0.4088728920440844,0.4933144883288663,0.238462647388374
Clicking a different button inside each loop iteration,0.7249522802121046,0.38379314317212593,0.0010675180154302124,0.4030556742768638,0.4940627388141806,0.2736869117495025
Updating Database using dynamically created form inputs using Play Framework 2,0.7950930193562746,0.4466539870289578,0.0018633874004933852,0.47458333457002516,0.5641954417687236,0.34945828047580063
"Assign ""ctrl + space"" behavior on jtable selection to another key",0.6584943465632391,0.344564960234573,0.0010278584883633758,0.3483727792410222,0.46705602643431926,0.28713450680010477
How to add an array to my line data?,0.8873844895408579,0.5044524242028737,0.0016829019967236785,0.5401337125654868,0.6329661583364408,0.38206638301575196
How can I prevent a package-private interface appearing in Javadoc?,0.7840392074797216,0.4097643578760926,0.002644580589425886,0.5107404788397039,0.5214201414645913,0.3354280077217074
Where can I find a list of events triggered by MongoDB?,0.7251401516746636,0.35225619270985536,9.309601758896505E-4,0.36565849447384663,0.48505221270483795,0.3090567208709822
"Javascript Regex, finding numbers in a string",0.6979729993107643,0.3189684675283581,7.533907605814663E-4,0.31594630899608434,0.47921203063967754,0.28217981240023937
MVC - How to put random images from a folder on the master page,0.7647124736730878,0.4283926969578333,0.001060327727042318,0.3947048681672828,0.5357350890882255,0.30731765671520794
How to pass zoomed region from one view to another xcode,0.7929790804921393,0.4259153452684846,0.001270117887625041,0.4041490001072117,0.5560756592609325,0.3537177918331439
Setting up MySQL issue under Eclipse PHP,0.7186452232569298,0.4618677944814857,0.0010191170271132048,0.3913424914348732,0.4706242953818513,0.2800170726115116
Simple properties to string conversion in Java,0.7044007123128809,0.31649078924543533,9.069914566519125E-4,0.342584397939272,0.4731189787224494,0.25070747024813295
LINQtoSQL Error: Comparison operators not supported!,0.6937377892018824,0.42483238729743633,0.005083444547236015,0.477871019786803,0.5017641028461622,0.3650096007790197
Navigation Tab Bar Controller to UIView Controller?,0.8237950701914645,0.4985305270452967,0.00900833062034407,0.5630440658959573,0.5901845959187781,0.4691262512007495
Delete rows out of table that is innerjoined and unioned with 2 others,0.7078342861334627,0.30390790112557386,9.244995774333653E-4,0.30084833798533456,0.5017730661390029,0.2932485559690876
Is there a Java local queue library I can use that keeps memory usage low by dumping to the hard drive?,0.8802549128790046,0.519227480225801,0.0015730253580927553,0.5279051003536861,0.6285379356374287,0.38338264589922133
Java sampling pixel color in swing,0.8448607155542018,0.47811932179747085,0.001451234745255039,0.5326007501684931,0.5863506785932986,0.30585289439249497
Facebook Tab App Sharing issue with Image,0.7511705181748619,0.4010630708902513,0.001103913930914599,0.38575714071880024,0.5061682255141434,0.2913552987026337
OpenGL ES App on iPad/X-Platform: C++ or Objective-C?,0.5961660473968701,0.30524193364047725,9.289016613067189E-4,0.24885448387415993,0.40705322306483294,0.257216115995528
Function required and not-required variables,0.5209135182264113,0.1858681408287049,8.489932588250208E-4,0.309235806739429,0.3953876746950419,0.24725114749717933
Click event does not fire default action,0.8604101559306927,0.48911012723595215,0.0014774534778787568,0.49365753176255184,0.6103043690422854,0.3871551482256782
object oriented JavaScript,0.7203060285984527,0.2553843711927541,0.0012076120652106512,0.22416993428142504,0.5041794984580191,0.27195862407137933
LIKE command Mysql,0.5970331334774464,0.28375351674961885,8.610874257419185E-4,0.3429314979430796,0.46965390288143244,0.31001308656688703
drag one div to another and change size of that other div when i am over it,0.75387895200725,0.26358572841697303,7.011969579298195E-4,0.2010690110560552,0.48831962294483655,0.25646331086885055
Keeping history of hash/anchor changes in JavaScript,0.53104609051553,0.12264809734047877,5.414007647284605E-4,0.18350012237772553,0.41912709986214064,0.20711363952133163
How can I use jQuery to move a div across the screen,0.7880042701296189,0.4573931993291742,0.0020838976261890146,0.5678876918285909,0.5398948898303374,0.3834878095074015
MySQL delete troubleshooting,0.3114051326005875,0.10816794085369281,2.7999595779429847E-4,0.0,0.2671929252678056,0.16884956689214117
"Add ""A""-directive to parent node and execute",0.6195066506007261,0.24048948709529985,0.0010147771679301252,0.30016983775723555,0.4316000184397344,0.2646590325238302
Deleting a record/multiple records with a checkbox(PHP/MYSQL),0.13161598096660376,0.0,1.8330038668569636E-4,0.0,0.12823898124706154,0.08361963274520864
"SQL Server, Select CASE with different casting",0.8165362997912021,0.4613787379966497,9.304692842360255E-4,0.2951192398877289,0.6091546489339439,0.4265680348688531
Clojure While Loop,0.6926414611891188,0.3770191933800027,8.2842444046745E-4,0.36244717623676925,0.43277798227540143,0.21935863749759288
Confirmation delete window - deleting record when click delete or cancel,0.8285674641911334,0.42559246147811725,0.0011967336911206173,0.41575257808653054,0.6123187168127039,0.3967074293054701
Non-45º triangle with aligned content,0.7601036744315329,0.39318721174060034,0.0011394557865400429,0.44242994547484693,0.5400985651557696,0.31807783878582374
Parts of site disappear on smaller screens,0.7356165156759984,0.3253697994071564,0.0015247470485972748,0.5863035278848018,0.5951804182089865,0.545587698142186
Missing artifact com.google.android:android:jar:4.4_r1,0.6587338669972835,0.3259493551532238,0.0010143640142511131,0.25184440189618695,0.4625194127060876,0.3114715466476398
Does Input/OutputStreams close on destruction?,0.6274575036498006,0.30769884834864614,8.852719833912543E-4,0.27154276974272634,0.48254178305941353,0.3551434834430796
Passing context to a Handlebars partial,0.6866681329399743,0.3307029175348172,7.823365686686015E-4,0.355732696792946,0.4646000458555584,0.25489711277320376
Crossbrowser php date to javascript date?,0.5538002000223995,0.3382293170990484,4.3826572069256093E-4,0.16708539491665175,0.32400021290219955,0.1718593639254146
SharePoint 2013 Calendar getSelector is undefined in IE,0.40475916806219525,0.11238769479094406,3.5207949382141647E-4,0.13107917744508,0.2634402616218036,0.11200042632795429
Running ajax request in javascript synchronously?,0.5596832581145924,0.24892316703452846,6.376724313749516E-4,0.2803765100337621,0.41255271706208063,0.2684233473356513
mysql update a cell C with the updated division of cell A and B,0.752265806872671,0.39612839825373314,0.0010883256717220513,0.37753358781331187,0.5021460830637959,0.2522643265019311
Under what situations will Java's field.setAccessible(true) fail?,0.5553063131994627,0.27688206483203803,0.0011257174157631397,0.359100791621223,0.39603720260981023,0.2223370607242106
Database value being truncated at special character,0.7354931599020016,0.3405773970281989,0.001715308565646312,0.4410981253787271,0.4991893789578022,0.25371745739535
