"Block a specific resource, not the entire website"
Question,WUP,RES,JCN,LIN,LCH,PATH,LESK,HSO
Truncate (not round) decimal places in SQL Server,0.6957823563697552,0.46433763463853867,7.314822992800132E-4,0.2786067754910772,0.4784645607609809,0.3049560517198423
implement select all check boxes functionality in asp using javascript,0.8277053480402791,0.5346770953419744,0.0012586642041721387,0.4005660770115986,0.5762258590868511,0.37016746729742545
"Add Action to ""Source"" Menu",0.7392012366715064,0.38754648255788543,0.0011579525580322752,0.42032478086057395,0.4945085311544777,0.2619006310897543
Transparent Status Bar Android 4.3,0.7320134124989636,0.4274209179824925,0.009008349108782085,0.4483183972977563,0.5258173498119667,0.4499524144184914
Eclipse: which plugins for HTML & Javascript?,0.3673505191089762,0.22270561094424832,2.872561098186113E-4,0.09470323069032588,0.25067013642525826,0.11826945957997102
IOS: Stay on the first view controller before complete all controls (StoryBoard),0.6227815956592907,0.37493346483360573,0.001184699695294984,0.3823002387285809,0.4242207996751912,0.29579581688958956
Top tips for designing GUIs?,0.8630824541444022,0.5477191493913328,0.0017211218645589554,0.5753227400599318,0.60914667886731,0.3578027648653865
re stylign anchor tag to remove jerky scroll,0.7936633445353495,0.4129059865911747,0.0011941671929747454,0.40102272576910036,0.5330427721758035,0.30639602412252964
How to fix this JOIN query?,0.66178209798774,0.3591694661759474,9.144282850925754E-4,0.38983328957930674,0.4609583344895733,0.2798160182718963
SQL style question: INNER JOIN in FROM clause or WHERE clause?,0.5880375438398889,0.27726430665336943,7.426821255360396E-4,0.32350567371153643,0.3813254271222693,0.22021806889943885
Allow certain characters in text field with regex,0.6636312304565781,0.3134789237468598,8.41744885857817E-4,0.31809241124354026,0.42780560105743703,0.20851729323190712
Count all cases with one MySQL statement,0.7721352250741401,0.36195409687514224,9.341815278591508E-4,0.345166785431804,0.5122879474364768,0.291071708987908
Refresh or re-execute JS code in an Iframe,0.648185141961233,0.2849797670230737,9.676425968933045E-4,0.2956347817943748,0.49207407391787217,0.29443658677312873
preventing keyboard drops while loading in iOS,0.8292046892021623,0.4332686336808375,0.002997380883164442,0.5348743847762051,0.5782931971806452,0.4055168821470099
How can I shorten the lines in javascript?,0.7100988171688638,0.30598501657790766,8.790306560803991E-4,0.3519100093868369,0.4373588975445746,0.23401538190530366
How to make layout Flexible in all versions of iPhones,0.5048205030937822,0.22543534091408202,6.880933764613173E-4,0.25609462637334957,0.34061404894541863,0.199046393845216
Basic returns and class question,0.8715621363100025,0.5251795867123129,0.0016656170877119936,0.609682044186237,0.6270833586258733,0.3731852465085618
Adding content to tinyMCE in wordpress,0.6259275392967723,0.25929034892343333,9.851552248951658E-4,0.36272512541875795,0.44982782758988915,0.26539961652297145
Fire 'object:moving' event from resetting position in Fabric.js,0.7471652877780781,0.3523407415356383,0.0014785982526754086,0.42727907578231716,0.5345178445842699,0.3350111837869223
popup page php data doesn't show on submit,0.6676214307187549,0.2482879059726835,9.070633699618542E-4,0.28478697169049777,0.4797915219590131,0.3033907182433301
How do we make a styled scroll bar for a <div> with mouse wheel sensitive,0.8666204704110235,0.5766441154152951,0.009008194552965877,0.585200101513876,0.6466083862158517,0.5132470036073961
INSERT ON DUPLICATE KEY UPDATE with WHERE clause,0.7972329589447428,0.464393742423138,9.131216063701584E-4,0.29895106373544594,0.5716766361717446,0.3524734494036981
Form handling PHP and Javascript,0.6840119280134416,0.36540755324818447,0.001180422640726251,0.39713595795058465,0.4602912519713541,0.3167531508730466
"iOS Development: Adding an ""Add Friend"" button inside my app",0.6468743598974522,0.3080632865982607,0.0010535324815121414,0.3349469455303106,0.4388325302288645,0.25208047801546096
"How to check if iPhone is jailbroken or not, from terminal on a Mac?",0.7330014118099034,0.447150650944243,0.0012334046292973705,0.4080464486298661,0.4743610006159126,0.31292752567848503
It is possible to connect Google Maps API v3 page with another page?,0.5195201364801444,0.13052777419676356,6.25310528674778E-4,0.14810496856076275,0.399923232057999,0.23902797416227775
How to read Parquet file using Spark Core API?,0.803014767803549,0.46893394886095946,8.975246201355852E-4,0.32923503278816685,0.5468742874240353,0.32300295178800015
XCode App randomly crashing - message sent to deallocated instance,0.5308962697643175,0.12875280354341642,7.771386667568052E-4,0.19388426554713878,0.3940411204442373,0.2138915051135575
Sending custom object as a parameter for a web-service,0.7867067800784822,0.4136501560504773,0.0013097787055281302,0.3828918093277774,0.5566189019541454,0.3126144129127121
Best way to disable cobertura test for all the child modules from the parent pom,0.7506967070262796,0.3307049551702265,0.0012683416411325692,0.400559713396192,0.5145527571505778,0.31011804503230345
$this->db->affected_rows() returns -1 after query in codeigniter,0.6008969696388796,0.36271796651405463,8.959494896996004E-4,0.32823005553846385,0.36248340240552124,0.18188327189104525
Getting FATAL EXCEPTION: main java.lang.StackOverflowError when creating an object,0.5501390231702409,0.16530951974715644,9.198651667927627E-4,0.19198416268153534,0.3801424317443134,0.18700592082480383
Is there a way to use the ARC migration tool on a per-file basis only?,0.8759611216752011,0.5115575546279273,0.00149018694489875,0.5783362336659241,0.608189662241059,0.35168174371645855
Is there a way to select HTML <option> automatically with a javascript injection?,0.6876459113339276,0.4147198384589781,6.945023223561898E-4,0.2301942027229537,0.45652686625058125,0.26492803957432576
"Very long delay loading tiles on panning, but they load immediately when zooming",0.6945454638891848,0.27839114013148164,8.486340543433153E-4,0.28267974055579004,0.49049821764734897,0.28456844019910804
Using ajax to post a form to php without refresh,0.7625739872510785,0.40400709155131626,0.0011973805867921165,0.39237607343895026,0.5613118315783892,0.3767502033123874
How to set CustomFrame on iCarousel in iphone?,0.5818049862117965,0.2798567089399597,6.543489942724469E-4,0.28114414374088775,0.3878453796783016,0.21994360268660232
What is the scope of variables in JavaScript?,0.6099066016059818,0.27867187359973933,6.733528480605605E-4,0.27533232056627593,0.37245611194531875,0.16209023822148344
mysql random generated value,0.47230366760460796,0.1627832619427105,8.521899087107573E-4,0.28671168506789974,0.3323146510014152,0.18126469774569534
A ASP.NET MVC page with multiple instances of user control consuming the independent data,0.6541481818555628,0.30581716189313923,0.0011521525780725413,0.36385506315391536,0.4330471637377858,0.24927111987984932
Adding item to array in java?,0.8617585961113579,0.3844735592242551,0.0012087754548400363,0.443240504842545,0.589150436016467,0.3143356876191877
WebMatrix set Insert_Identity on,0.6416632818682977,0.3199387913745051,7.55577081617366E-4,0.3202035822655918,0.43920292492609725,0.25237952849330964
Hash table in JavaScript,0.6697463365120396,0.22001936908845296,6.852123379776511E-4,0.2130899048668189,0.4310922245114156,0.19467055247986945
How can I check with which options was program compiled?,0.7289218358709915,0.4794203625382387,0.0014373983964855528,0.45604032903758335,0.478060846811301,0.31478048123866925
Reason for a fragment to not show up,0.8022493519117536,0.36038738700409634,9.356946020223234E-4,0.2716971357034715,0.5749010489524163,0.34478641370831825
Is it possible to utilize carrier data and WiFi connections simultaneously within an App?,0.6660312927607952,0.24664932575970758,5.663697801914815E-4,0.21628523029998012,0.37581863966578327,0.16864051722632095
Why isn't a direct call to my JavaScript function being recognized?,0.7727829884256079,0.4088182127364225,0.0011285607983752494,0.3207354385849412,0.547508257666874,0.38235624635700355
calculate determinant calculation in java,0.7620887377556672,0.2534469633518617,0.001114645264208576,0.34454092614935505,0.5476121894226742,0.304943523197043
"[SOLVED ]Tomcat7 won't start up on ubuntu (clean install), permission denied",0.4310750684532672,0.19288710264158607,7.418871988468124E-4,0.26315380537285465,0.30522987607999175,0.20179361103642315
Order of an item in MySQL query result,0.7595204445102866,0.35244442284209465,0.001020319615699116,0.356379606515612,0.5221608831906638,0.28766128879889374
Adding days and time to a timestamp in MySQL,0.584289007225526,0.19937927938512318,8.555212767479327E-4,0.27432031996709344,0.424521595058121,0.222581784842862
"i want to find a folders and if folder exist, then need to find sub folders and folders in sub folders through Java code",0.7443240121963736,0.3055016661416369,0.0010288963495484723,0.3273352004424614,0.5414137703865484,0.32635149053477014
How to implement scrollViewDidScroll: method?,0.6909771715691158,0.3559141307184501,0.0012755039902364593,0.4542906566317776,0.45284919799915346,0.23116621378582838
Java Insertion Sort with an Array List of objects?,0.8802216533220618,0.45572530175636006,0.0015338771980584857,0.49681765154856034,0.598370769156807,0.3177037382592098
set style with :hover javascript,0.6999105982728769,0.31781170259491714,9.665830626736316E-4,0.350372103835811,0.4988238050569781,0.3119512287903842
secure ODBC connection -- oxymoron?,0.7384638939772191,0.3285521259457122,8.029528706513362E-4,0.31924029698855,0.5265753597917917,0.31137988981933207
Idle time out exception in Server Client socket,0.8766721523270636,0.5209013853850406,0.0010485912226100198,0.29042336143983877,0.6678905450238377,0.44130162793431227
How do I view model data after fetch in backbone.js,0.8199660402851497,0.41707039076954144,0.0010974640558802516,0.3425593526375757,0.5483647312422498,0.3191510400728814
UINavigation bar disappearing in iPhone 4 (iOS 7.1.2),0.553663176401617,0.3031201493368249,0.0090079724989125,0.29399303750287603,0.39244118880914025,0.3549224605178886
js get radio label text,0.8343010049464954,0.49992996616961044,0.0010433659296643053,0.38514026451467237,0.5668822194905845,0.32641638808491
How to return null inside the function/method if a property in the class is not found?,0.8110475945097149,0.47499672165888845,0.0016606287874724596,0.5534507005971695,0.590773395074323,0.35854403508238974
Parsin JSON Using Javascript and using the result as AJAX,0.5077430582380905,0.1910682268868038,5.228104721420318E-4,0.16030883575017355,0.3634293922542409,0.18027778477072745
Size of character in pixels,0.7258441981446959,0.3713231779235159,0.0017173138185837852,0.462753614292506,0.48245831106121984,0.23972588374665116
Spring beans config files not finding classes from dependencies declared in gradle,0.6992110668240816,0.2860259437776745,8.794195523206724E-4,0.2961995928836592,0.4700861915629536,0.2957128292774488
how to close the native video player in Air for iOS using StageWebView,0.7546776820360408,0.4058257898152184,0.0010726689212804358,0.4091952654284709,0.5146669846370856,0.3304823625876631
Unsetting jQuery element manipulation automatically?,0.6982244659658008,0.39544227301128726,7.617130587342988E-4,0.27138639507582024,0.4356925340855502,0.19572187415300335
Remove a generated panel in GWT after a button is clicked,0.7437670737355482,0.39728095091988513,0.0011052018367923154,0.3563823749204961,0.5291954989507823,0.3392340805675301
Form submission and mail send,0.8362048703314058,0.4332727655434534,0.0014721769912739492,0.4507436224708901,0.627396339462785,0.43908849142024015
Creating a user account in AD with JNDI and minimum password age,0.6627207338070009,0.30130981342895036,8.333928320486457E-4,0.26470143192921897,0.4866255463061531,0.2546821498534851
Spinning javascript menu,0.646678121070604,0.205517357376454,4.7396868311301284E-4,0.17347702208671667,0.3751230023052279,0.14575308347710794
The most efficient way to get a hall of fame/shame in a photo rating system like this,0.7078612256696999,0.42381441760307537,0.0012334557231712898,0.45214970413876326,0.491971486361892,0.2991037729686649
Android – Am I Doing this Right?,0.6976340264638581,0.3818107908059365,5.523019397021307E-4,0.17547174082714734,0.3938207347016997,0.17139817387079018
System.getenv doesn't get variables defined in ~/.bash_profile,0.32974941697555005,0.2020515499679526,3.607414608676182E-4,0.13294219962553658,0.20529141902651807,0.13414032847381396
How to setup MVC routes to handle old ASP classic pages redirects,0.7457990095949838,0.38891285548712334,9.200733494706144E-4,0.28608730473922644,0.5090672308499902,0.28047929424314094
Why is my variable is null?,0.7700511808071171,0.2905405805889245,9.470665989991713E-4,0.269082400217152,0.5122639650645349,0.21790657125237672
unable to instantiate component info,0.6554521426886005,0.17856642508904982,0.001141888025777278,0.28088146009038456,0.4808220107353555,0.2411059776000947
How to get an error back when file limit is reached? Plupload + asp.net mvc 3 + web.config,0.6596639275635263,0.41980620385264117,9.60198890853178E-4,0.3857110803213986,0.4450939408926044,0.2894002545019684
mySQL query -- conditional select,0.451497092317768,0.10329801634136226,6.566661992348107E-4,0.16481701680005795,0.32908405200804386,0.1767367421130384
Raphael.js Newbie :How to create a link to open raphael graph in own browser in my case?,0.6952804730148582,0.28179166044875353,6.948160668937218E-4,0.26114524333427297,0.46437936262939983,0.2410072563473586
How do you pass a variable to a Regular Expression JavaScript?,0.7578252485979007,0.3600416147910773,0.0011340378350798248,0.4452514746581995,0.5111772508023393,0.28111492582185804
HTML5 Fitting To Screen Resolution,0.7782540456510573,0.4879964857323247,0.0019305056153660538,0.4843921469577468,0.5484299529810017,0.3880526574374669
"Groovy 2.0.1, GroovyCastException on my own class?",0.5071505385055258,0.21006465484316703,6.778727694792164E-4,0.27118625052009837,0.36771524404451383,0.2138090299635886
"How to avoid the ""divide by zero"" error in SQL?",0.4859658371988684,0.24309166976680832,0.001442545818883924,0.39142807403153607,0.34737295552190434,0.2093045654663755
Storing user action data in MySQL: one table or many?,0.7988775150319917,0.41613191843759856,0.0014928765496565956,0.5033473061045495,0.5100188829297906,0.24997091197516405
"On field UPDATE if value is already SET, SET it to something else?",0.8569108576062715,0.4841854737226421,0.001581367805389366,0.5434728327073289,0.6348821241363625,0.3948434838885712
How to find checked RadioButton inside Repeater Item?,0.7418119464730297,0.3186880498559765,7.761291923428764E-4,0.29200440936154864,0.5068430306001541,0.29128253870069265
"Authenticate via Active Directory using LDAP, Java Play Framework",0.7833026758258889,0.41889178269963573,0.0018894218476780533,0.47279305500477387,0.540648428441853,0.27933251780450763
WebSite Javascript Search Engine,0.7517627456200747,0.477499451725279,0.2243239109613022,0.5131379042052365,0.5787353986603326,0.44386288691999704
"How can I keep this ""onclick"" from happening more than once?",0.5984383185992067,0.24387432018057018,6.702469277312453E-4,0.27136801441004504,0.340755620121087,0.1703817611635425
Find the class of the generic object,0.8530872803673611,0.3891491400351961,0.0013349839696183453,0.4101258951560321,0.6358146919418349,0.3907806533607933
How can I make sure that a user visits a page of my site only if he's redirected from a specific function?,0.9379362303108406,0.5392987382192848,0.14289576757298939,0.7229268999939289,0.7763914591606125,0.6526783526630474
NULL ForeignKeyTo property in Subsonic 3/ASP.NET MVC?,0.6335253622786111,0.3116352690194245,0.0012073517327302397,0.3715287677888286,0.42406085971231705,0.22609752627766794
NZEC Prime number Generation SPOJ- http://www.spoj.com/problems/PRIME1/,0.6338024351241106,0.2863063043099276,7.219426045251228E-4,0.25783334676261027,0.41029225100596994,0.2159839330799184
Streamlining Database/Login Process with PHP/MySQL,0.5649373266801369,0.21532526691175446,7.089507452097092E-4,0.23530608584725315,0.4076966597157333,0.2052359931587529
__DoPostback posts back the values of disabled controls when doing a partial postback,0.5398450110187931,0.2571903537767076,4.3058922805770596E-4,0.1606725216184971,0.3421901135773418,0.19158706713004744
What does ?: mean in Java,0.6044232435358696,0.2200268825814655,8.873938604539258E-4,0.30101816667838405,0.46043117520557664,0.2668332128067799
Facebook style like system in modx cms (php),0.6231094217366766,0.3011354425208307,9.331199670988182E-4,0.3236138268259839,0.42292526917834306,0.25298339139387016
Convert array from with keys to without keys,0.8796376184881488,0.5000985001597213,0.0010410225981722025,0.4250998622995092,0.6045926844872261,0.37208437961879487
My AngularJS app doesn't load my controller/view,0.5808718140216406,0.25339429418916887,5.428769122052669E-4,0.2006035758523209,0.3707824330326959,0.18646595131766894
JavaScript Nested function,0.5209135182264113,0.1858681408287049,8.489932588250208E-4,0.309235806739429,0.3953876746950419,0.24725114749717933
EJB Overriding JPA javax.persistence,0.0,0.0,0.0,0.0,0.0,0.0
"Can't seem to Understand this Array declaration, Need Liberation",0.7445221624805672,0.26137685070965977,9.568893955235635E-4,0.2709270549849748,0.49554798097437397,0.29102784456816255
How would I do this with SQL Server?,0.7276974779251538,0.4430391276671299,6.999960705392095E-4,0.22271374716195555,0.45362150757201947,0.24816286116156158
SQLite exeption coulmn does not exist,0.21170244960998524,0.0,3.52046557016879E-4,0.0,0.19119605781804241,0.14543584966911588
variable not being passed?,0.7982518640343497,0.39767809588306946,0.001040641087328498,0.4568921994737551,0.5571269449938892,0.3259786233295587
Can't style a div with javascript,0.6535105618570326,0.28225742960236944,8.111471340373681E-4,0.30470950924195433,0.42033768879929223,0.22297506490577426
How to update the subdocument of mongodb Collection using java,0.5755913175512202,0.2796208199291439,8.114659861212268E-4,0.21583574381999512,0.4339956371562836,0.2430458916768913
How to place tab bar on top of the view,0.9042039340058803,0.5730182249377075,0.009008387103159578,0.574392500097307,0.68729525411257,0.5674145925553972
MyISAM vs Innodb and Innodb related tables,0.5328924500565771,0.1824904483420532,5.934113272128605E-4,0.18568180949379873,0.3226865926604694,0.13771195970200842
How to update MySql timestamp column manually to current timestamp through PHP,0.6295691285091216,0.3106088426510163,7.192388904773533E-4,0.2665253864762004,0.4077348135865994,0.20585825970665025
Insufficient privileges when creating a trigger for a table in another schema,0.6590282681245553,0.27602354532063667,7.399935300005579E-4,0.2796197348376454,0.42687603670062296,0.24451884188346604
What is the difference between single and double quotes in SQL?,0.6030060510684327,0.2666150129647313,8.420909959754576E-4,0.3433690395565157,0.38943718887358797,0.21913223484339805
"Are Java EE 5, 6, & 7 compatible application servers compatible with J2EE?",0.7328562853121017,0.4425562356087845,8.279160152673298E-4,0.23239097377822038,0.49394058509320976,0.24821785263948357
JQuery Script Load Timing,0.7270207000212172,0.30111307421488553,8.714736164433185E-4,0.27669744240837385,0.4941485092740783,0.24934589953011377
"Hide element after time period without ""shrinking effect""?",0.7472769206510149,0.39654256565559526,0.0012477772577316661,0.4223721120678548,0.5380663040575647,0.3516356107578823
How do I alter the anchor point of an overlay div in js?,0.8435722997305933,0.5363167319907604,0.0015073104761721076,0.4888461761557827,0.5758161835044641,0.3475733482427604
What is the best way to layout a seating chart and what is the best way to convert off a table structure?,0.8848124138619738,0.4505539175866795,0.0017571873047960375,0.5454981630867954,0.6274352286159011,0.3630163471619374
How to compose queries/subselect with Esqueleto?,0.1981169324132623,0.0,3.542111488853553E-4,0.0,0.19317966755845664,0.12698412698412698
What is the difference between casting and coercing?,0.7500907502797175,0.2985015037988493,0.0010301644412713568,0.3185513838591819,0.5606500426991134,0.38503845752781735
Referer null help me,0.6909645186002598,0.26764995623231186,8.350231307394067E-4,0.22761247118008257,0.4107692617777511,0.16922993325395452
What Google API do I use to find search popularity,0.7628450215656342,0.30375028876816634,0.0011197314607158226,0.410142934717383,0.560346142250711,0.36171131091571534
Error setting expression 'supplierPaidChecks[0].checkNo' with value '[Ljava.lang.String;@1ac1423',0.6140929733237601,0.33647675258691623,0.001023779913972949,0.3522583887738372,0.40417327355833493,0.21060723262451564
Email to rows in html table populated with data from mysql database via while loop,0.6432768558334502,0.25039581758327223,7.332863993484012E-4,0.245013696670611,0.426729513836635,0.2150478032042811
"LINQ, Repository Pattern and Database Abstraction",0.7773480164280916,0.3148996025547448,0.0012778169186129116,0.3539750438876986,0.5479569476788912,0.2929828111118893
How to get java script console ouput of browser in java?,0.7119066689483035,0.40147707623074125,8.678107381565836E-4,0.27252806197662394,0.4719742651671046,0.2786662451254489
Android: EditText onclick content,0.6401362044358898,0.35401361977628304,7.118435151313355E-4,0.2658251267626379,0.4198904077224662,0.23267335789275073
mysql server won't start MAMP,0.7292749558679351,0.5185078641130842,0.001108311497838315,0.3986316900623771,0.5090162484687595,0.34777548696154653
JPanel has not been changed due to its given x-coordinate in setBounds() method,0.5714127631464794,0.2958065119832129,9.093337960388603E-4,0.3042319914365513,0.3970259024775471,0.18316920271071688
How to wait for event to happen without blocking?,0.8239535144366014,0.48346586972672667,0.2589792605992465,0.4639929226175019,0.6537807569246634,0.47510641174112134
How to handle SPA authentication to an ASP.NET MVC 5 back end without using Session?,0.7979325051609862,0.43172833287819823,0.0012418848301012067,0.4047762770040413,0.5415708102887513,0.31752537073705595
Singleton Design Pattern: Pitfalls,0.8154996563350415,0.46583380951511694,0.0012341770614088083,0.41458298452145037,0.5683072046033604,0.31667183611690064
GridBagLayout and FlowLayout: Components appearing at unexpected positions,0.2812657695554692,0.028439802754011236,3.702346504411711E-4,0.050488109409005416,0.22297277118742376,0.10968724687355398
MySQL Question about scheduling,0.6142375712683876,0.22888324374847485,8.694502061299719E-4,0.34136983559680256,0.42303869102542546,0.20570331068742914
delaying infinite scroll with jquery or javascript,0.5675064913726799,0.22036073225188846,7.435295300659919E-4,0.31395774570258783,0.4068409715080438,0.21886533774073597
Android.text.format.Time not setting isDst correctly?,0.5620329711490707,0.304469461728526,5.27585694401535E-4,0.21540640075825113,0.34437448645844904,0.16891464648872218
How to run android code in eclipse,0.8268186685560475,0.5444169869043002,8.732745425100764E-4,0.3808075646032636,0.5803955420089643,0.3866342266534768
Google Maps - Too Many API Calls?,0.560494209351895,0.2747933564593149,4.813940704504705E-4,0.18946745282704144,0.3746876408700314,0.21828700790287023
How to search through a LinkedList for an object with a certain variable in Java?,0.7405296128087472,0.2643022418508419,0.0013130767059527993,0.3623683893388449,0.5268415293993851,0.29653301295101386
How to convert 2014-05-05T09:14:52.150Z string to get current system time,0.7121306974858841,0.4091109861091362,0.0010899935496795961,0.3976826687936243,0.505805603299636,0.3050931699885414
POST Ajax call results in not found using jqGrid and ASP.NET MVC 2 on IIS6,0.6798992258397214,0.3609317542723916,8.208042820892566E-4,0.29617534566246534,0.48507485486117474,0.2897743831665737
Programatically transferring mysql data between separate servers,0.7413030172764824,0.4206704067962488,8.475607117940628E-4,0.27743180493511943,0.5018226800922518,0.33345649049985226
ExtJs - File Uploading Error on IE8 + IE9,0.5267966999227982,0.29756268823401666,5.712884591358451E-4,0.24422831942161594,0.314022032725905,0.1600922340476287
Swing Component JFrame visibilty,0.6882451316111702,0.3973529476590662,0.0015582083399381158,0.47856826588707413,0.45981978817979335,0.24009340215144231
Terminated due to Memory Error when load number of view into UIScrollView,0.8101595579516906,0.4341514726466009,0.0011951958511237871,0.4535375545655588,0.5336981099318978,0.29076858918021253
what is the best way to create connection Class in C#,0.716742313106687,0.35683204391647577,9.578431738703325E-4,0.38517710552101686,0.49426630255684517,0.2901854564475393
programming touchpad of laptop,0.734432215056509,0.5288543876741286,9.032116986481898E-4,0.3276278856806264,0.46165077869390087,0.22855837775034496
Java & Hibernate project - sort by date,0.7511359272046666,0.40588818727608517,0.0010449606105879434,0.3501070735883766,0.5322326524507188,0.3220756001871134
Securing my REST API with OAuth while still allowing authentication via third party OAuth providers (using DotNetOpenAuth),0.5810529074692875,0.2879448260624495,8.26602878333177E-4,0.30728217992761253,0.38780556822627815,0.23425747755965623
"Chrome extension, file from string?",0.8582436787567879,0.503177195033227,0.001099573580405821,0.4701323214486565,0.5842822328974534,0.33619049753008595
HTML form submit and redirect simultaneously,0.46943446796432736,0.1614384780395665,3.467904134124784E-4,0.0,0.3822696723737941,0.2259627475809022
Battery Doctor cleaning up the cache from my app,0.7801230026923576,0.5003381557173279,9.769365428598394E-4,0.39656481421035095,0.5479957432416739,0.3387180260589015
